,product,brand,price ($),life_stage,special_diet,review_num,review_star,ingredients,protein,fat,fiber,moisture,
290,Wellness Complete Health Grain-Free Indoor Deboned Chicken Recipe Dry Cat Food,Wellness,32.29,Adult,"Grain-Free, Indoor, No Corn No Wheat No Soy",27,3.8,"Deboned Chicken, Chicken Meal, Dried Ground Potatoes, Peas, Turkey Meal, Ground Flaxseed, Lentils, Potatoes, Pea Fiber, Tomato Pomace, Chicken Fat (preserved with Mixed Tocopherols), Cranberries, Natural Turkey Flavor, Choline Chloride, Potassium Chloride, Chicory Root Extract, Taurine, Calcium Chloride, Vitamin E Supplement, L-Carnitine, Zinc Proteinate, Mixed Tocopherols added to preserve freshness, Glucosamine Hydrochloride, Chondroitin Sulfate, Zinc Sulfate, Calcium Carbonate, Niacin, Iron Proteinate, Ferrous Sulfate, Vitamin A Supplement, Ascorbic Acid (Vitamin C), Copper Sulfate, Thiamine Mononitrate, Copper Proteinate, Manganese Proteinate, Manganese Sulfate, d-Calcium Pantothenate, Sodium Selenite, Pyridoxine Hydrochloride, Riboflavin, Dried Kelp, Yucca Schidigera Extract, Biotin, Vitamin D3 Supplement, Calcium Iodate, Vitamin B12 Supplement, Folic Acid, Dried Lactobacillus plantarum Fermentation Product, Dried Enterococcus faecium Fermentation Product, Dried Lactobacillus casei Fermentation Product, Dried Lactobacillus acidophilus Fermentation Product, Rosemary Extract, Green Tea Extract, Spearmint Extract.",34.00%,10.00%,5.00%,10.00%,
291,Simply Nourish Source Fish & Chicken Recipe High-Protein Grain-Free Adult Indoor Dry Cat Food,Simply Nourish,29.99,Adult,"Grain-Free, High-Protein, Indoor",39,4.2,"Deboned Whitefish, Chicken Meal, Turkey Meal, Dried Potatoes, Dried Peas, Deboned Chicken, Pea Fiber, Chicken Fat (Preserved with Mixed Tocopherols), Ground Flaxseed, Dried Egg Product, Natural Flavor, Dried Chicory Root, Dried Cranberries, Vitamins (Vitamin E Supplement, Niacin Supplement, Vitamin A Supplement, Thiamine Mononitrate, d-Calcium Pantothenate, Pyridoxine Hydrochloride, Riboflavin Supplement, Folic Acid, Menadione Sodium Bisulfite Complex (Vitamin K), Vitamin D3 Supplement, Biotin, Vitamin B12 Supplement), Choline Chloride, Taurine, Minerals (Potassium Chloride, Calcium Carbonate, Zinc Sulfate, Ferrous Sulfate, Zinc Proteinate, Iron Proteinate, Manganese Sulfate, Copper Sulfate, Copper Proteinate, Manganese Proteinate, Calcium Iodate, Sodium Selenite), Mixed Tocopherols & Citric Acid (Preservatives), Rosemary Extract.",39.00%,16.00%,8.00%,10.00%,
292,"Royal Canin Aroma Selective Dry Cat Food, 3-lb bag",Royal Canin,16.19,Adult,normal,64,4.6,"Fish Meal, Corn, Brown Rice, Corn Gluten Meal, Wheat, Chicken Fat, Wheat Gluten, Natural Chicken Flavor, Rice Hulls, Vegetable Oil, Dried Beet Pulp, Calcium Sulfate, Monocalcium Phosphate, Dl-Methionine, Salt, Potassium Chloride, Calcium Carbonate, Choline Chloride, Taurine, Vitamins [Dl-Alpha Tocopherol Acetate (Source of Vitamin E), L-Ascorbyl-2-Polyphosphate (Source of Vitamin C), Niacin Supplement, Biotin, Riboflavin Supplement (Vitamin B2), D-Calcium Pantothenate, Pyridoxine Hydrochloride (Vitamin B6), Vitamin A Acetate, Thiamine Mononitrate (Vitamin B1), Folic Acid, Vitamin B12 Supplement, Vitamin D3 Supplement], Marigold Extract (Tagetes Erecta L.), Trace Minerals (Zinc Oxide, Ferrous Sulfate, Zinc Proteinate, Manganese Proteinate, Copper Sulfate, Manganous Oxide, Copper Proteinate, Calcium Iodate, Sodium Selenite), Rosemary Extract, Preserved with Natural Mixed Tocopherols and Citric Acid.",31.00%,13.00%,4.60%,8.00%,
293,Merrick Purrfect Bistro Grain-Free Real Salmon + Sweet Potato Recipe Adult Dry Cat Food,Merrick,35.99,Adult,"Grain-Free, Gluten Free, No Corn No Wheat No Soy",139,4.3,"Deboned Salmon, Chicken Meal, Turkey Meal, Sweet Potatoes, Peas, Potatoes, Pea Protein, Chicken Fat (preserved with Mixed Tocopherols), Dried Egg Product, Potato Protein, Natural Flavor, Tapioca, Ground Flaxseed, Phosphoric Acid, Inulin (from chicory root), Dried Whey Protein Concentrate, Sunflower Oil, Choline Chloride, Salt, Organic Dried Alfalfa Meal, Sunflower Oil, Taurine, Minerals((Iron Amino Acid Complex, Zinc Amino Acid Complex, Zinc Sulfate, Sodium Selenite, Manganese Amino Acid Complex, Copper Amino Acid Complex, Copper Sulfate, Potassium Iodide, Cobalt Proteinate, Cobalt Carbonate), Yucca Schidigera Extract, Vitamins(Vitamin E Supplement, Vitamin B12 Supplement, d-Calcium Pantothenate, Vitamin A Acetate, Thiamine Mononitrate, Niacin, Pyridoxine Hydrochloride, Riboflavin Supplement, Biotin, Vitamin D3 Supplement, Folic Acid), Dried Bacillus coagulans Fermentation Product, Dried Lactobacillus Plantarum Fermentation Product, Dried Lactobacillus Casei Fermentation Product, Dried Enterococcus Faecium Fermentation Product, Dried Lactobacillus Acidophilus Fermentation Product.",38.00%,17.00%,3.50%,11.00%,
294,"Blue Buffalo Freedom Indoor Mature Chicken Recipe Grain-Free Dry Cat Food, 11-lb bag",Blue Buffalo,33.98,Senior,"Indoor, Grain-Free, Gluten Free, No Corn No Wheat No Soy",91,4.8,"Deboned Chicken, Chicken Meal, Tapioca Starch, Peas, Potatoes, Potato Starch, Pea Protein, Menhaden Fish Meal (source of Omega 3 Fatty Acids), Pea Fiber, Chicken Fat (preserved with Mixed Tocopherols), Powdered Cellulose, Flaxseed (source of Omega 6 Fatty Acids), Natural Flavor, Fish Oil (source of DHA-Docosahexaenoic Acid), DL-Methionine, Choline Chloride, Dehydrated Alfalfa Meal, Potassium Chloride, Taurine, Dried Chicory Root, L-Lysine, Alfalfa Nutrient Concentrate, Calcium Carbonate, Vitamin E Supplement, Potassium sulfate, Salt, preserved with Mixed Tocopherols, Sweet Potatoes, Carrots, L-Ascorbyl-2-Polyphosphate (source of Vitamin C), L-Carnitine, Vegetable juice for color, Ferrous Sulfate, Niacin (Vitamin B3), Iron Amino Acid Chelate, Zinc Amino Acid Chelate, Zinc Sulfate, Blueberries, Cranberries, Barley Grass, Parsley, Turmeric, Dried Kelp, Yucca Schidigera Extract, Copper Sulfate, Thiamine Mononitrate (Vitamin B1), Copper Amino Acid Chelate, Biotin (Vitamin B7), Vitamin A Supplement, Manganese Sulfate, Manganese Amino Acid Chelate, Pyridoxine Hydrochloride (Vitamin B6), Calcium Pantothenate (Vitamin B5), Riboflavin (Vitamin B2), Vitamin D3 Supplement, Vitamin B12 Supplement, Folic Acid (Vitamin B9), Dried Yeast, Dried Enterococcus faecium fermentation product, Dried Lactobacillus acidophilus fermentation product, Dried Aspergillus niger fermentation extract, Dried Trichoderma longibrachiatum fermentation extract, Dried Bacillus subtilis fermentation extract, Calcium Iodate, Sodium Selenite, Oil of Rosemary.",30.00%,12.00%,8.00%,9.00%,
295,Purina Pro Plan Savor Shredded Blend Indoor Turkey & Rice Formula Dry Cat Food,Purina Pro Plan,39.59,Adult,"Indoor, Pea-Free",96,4.6,"Turkey, Corn Gluten Meal, Chicken Meal, Brewers Rice, Powdered Cellulose, Soybean Meal, Animal Fat Preserved With Mixed-Tocopherols, Soy Protein Isolate, Dried Egg Product, Cassava Root Flour, Animal Liver Flavor, Soy Protein Concentrate, Sodium Caseinate, Wheat Flour, Glycerin, Chicken, Inulin, Gelatin, Potassium Chloride, L-Lysine Monohydrochloride, Salt, Calcium Carbonate, Added Color, Choline Chloride, Taurine, Vitamin E Supplement, L-Cysteine, Zinc Sulfate, Sodium Bisulfate, Ferrous Sulfate, L-Ascorbyl-2-Polyphosphate (Vitamin C), Manganese Sulfate, Niacin, Vitamin A Supplement, Calcium Pantothenate, Thiamine Mononitrate, Copper Sulfate, Riboflavin Supplement, Vitamin B-12 Supplement, Pyridoxine Hydrochloride, Folic Acid, Vitamin D-3 Supplement, Calcium Iodate, Biotin, Menadione Sodium Bisulfite Complex (Vitamin K), Sodium Selenite. A-4611.",38.00%,14.00%,7.50%,12.00%,
296,"I and Love and You Naked Essentials Salmon & Trout Recipe Grain-Free Dry Cat Food, 3.4-lb bag",I and Love and You,11.46,Adult,"Grain-Free, No Corn No Wheat No Soy, High-Protein",,,"Salmon, Chicken Meal, Turkey Meal, Chickpeas, Lentils, Ground Peas, Pea Starch, Chicken Fat (Preserved With Mixed Tocopherols), Flaxseeds, Trout, Dried Beet Pulp, Canola Oil, Sweet Potatoes, Natural Flavor, Salt, Brewers Dried Yeast, Choline Chloride, Potassium Chloride, Dried Whole Egg Product, Niacin Supplement, Vitamin E Supplement, Vitamin A Supplement, Vitamin D3 Supplement, D-Calcium Pantothenate, Riboflavin Supplement, Vitamin B12 Supplement, Biotin, Thiamin Mononitrate, Pyridoxine Hydrochloride, Menadione Sodium Bisulfate (Source Of Vitamin K), Folic Acid, Zinc Sulfate, Ferrous Sulfate, Calcium Carbonate, Copper Sulfate, Manganese Sulfate, Sodium Selenite, Calcium Iodate, Dl-Methionine, Fish Oil, Taurine, Dried Chicory Root, Zinc Proteinate, Iron Proteinate, Copper Proteinate, Manganese Proteinate, Dried Lactobacillus Aciphophilus Fermentation Product, Dried Lactobacillus Plantarum Fermentation Product, Dried Lactobacillus Reuteri Fermentation Product, Dried Bifidobacterium Animalis Fermentation Product, Dried Enterococcus Faecium Fermentation Product.",34.00%,14.00%,4.00%,12.00%,
297,Fussie Cat Market Fresh Salmon & Chicken Recipe Grain-Free Dry Cat Food,Fussie Cat,31.89,Adult,"Grain-Free, Natural",147,4.6,"Salmon, Chicken Meal, Peas, Chickpeas, Chicken Fat (Preserved with Mixed Tocopherols and Citric Acid), Turkey Meal, Pea Flour, Natural Flavors, Flax Seeds, Catfish Meal, Salmon Meal, Dicalcium Phosphate, Fructooligosaccharide, Potassium Chloride, Minerals (Iron Proteinate, Zinc Proteinate, Copper Proteinate, Manganese Proteinate, Cobalt Proteinate), Dl Methionine, Choline Chloride, Blueberries, Cranberries, Vitamins (Vitamin A Acetate, Vitamin D3 Supplement, Vitamin E Supplement, Niacin, D-Calcium Pantothenate, Thiamine Mononitrate, Riboflavin Supplement, Pyridoxine Hydrochloride, Folic Acid, Biotin, Vitamin B12 Supplement), Taurine, Lactic Acid, Kelp Meal, Calcium Iodate, Sodium Selenite, Rosemary Extract.",36.00%,16.00%,5.00%,10.00%,
298,Halo Holistic Wild Salmon & Whitefish Recipe Adult Dry Cat Food,Halo,26.18,Adult,"Non-GMO, GMO-Free",102,4.6,"Salmon, Whitesh, Dried Egg Product, Dried Peas, Oatmeal, Soy Protein Concentrate, Pearled Barley, Chicken Fat (Preserved With Mixed Tocopherols), Potato Protein, Natural Flavor, Flaxseed, Pea Fiber, Calcium Sulfate, Dicalcium Phosphate, Dried Bacillus Coagulans Fermentation Product, Dried Blueberries, Dried Cranberries, Dried Carrots, Dried Sweet Potatoes, Salt, Inulin, Vitamins (Vitamin E Supplement, Niacin Supplement, Thiamine Mononitrate, D-Calcium Pantothenate, Vitamin A Supplement, Pyridoxine Hydrochloride, Riboavin Supplement, Vitamin D3 Supplement, Vitamin B12 Supplement, Folic Acid, Biotin), Potassium Chloride, Minerals (Zinc Proteinate, Iron Proteinate, Copper Proteinate, Manganese Proteinate, Sodium Selenite, Calcium Iodate), Taurine, Mixed Tocopherols (Preservative), L-Ascorbyl-2-Polyphosphate.",32.00%,16.00%,5.00%,10.00%,
299,Chicken Soup for the Soul Weight & Mature Care Chicken & Brown Rice Recipe Dry Cat Food,Chicken Soup,28.7,Senior,"Weight Control, No Corn No Wheat No Soy",130,4.3,"Chicken, Chicken Meal, Turkey Meal, Brown Rice, Peas, Faba Beans, Cracked Pearled Barley, Tomato Pomace, Natural Flavor, Potato Protein, Turkey, Duck, Salmon, Chicken Fat (Preserved With Mixed Tocopherols), Powdered Cellulose, Sodium Bisulfate, Calcium Carbonate, Choline Chloride, Salt, Taurine, Mixed Tocopherols (Preservative), Citric Acid (Preservative), Dried Chicory Root, Dried Kelp, Carrots, Apples, Tomatoes, Blueberries, Spinach, Cranberries, Rosemary Extract, Parsley Flakes, Vitamin E Supplement, Zinc Proteinate, Zinc Oxide, Niacin Supplement, L-Ascorbyl-2-Polyphosphate, Ferrous Sulfate, Yucca Schidigera Extract, Manganous Oxide, Manganese Proteinate, Vitamin A Supplement, Copper Sulfate, D-Calcium Pantothenate, Thiamine Mononitrate, Riboflavin Supplement, Pyridoxine Hydrochloride, Sodium Selenite, Copper Proteinate, Dried Lactobacillus Acidophilus Fermentation Product, Dried Lactobacillus Casei Fermentation Product, Dried Lactobacillus Plantarum Fermentation Product, Dried Enterococcus Faecium Fermentation Product, Vitamin D3 Supplement, Calcium Iodate, Folic Acid, Cobalt Carbonate, Inositol, Biotin, Vitamin B12 Supplement.",34.00%,8.00%,8.00%,10.00%,
300,Blue Buffalo Basics Limited Ingredient Grain-Free Formula Turkey & Potato Indoor Mature Dry Cat Food,Blue Buffalo,34.98,Senior,"Sensitive Digestion, Indoor, Limited Ingredient Diet, Grain-Free, No Corn No Wheat No Soy",84,4.6,"Deboned Turkey, Turkey Meal, Peas, Potatoes, Tapioca Starch, Pea Starch, Pea Protein, Pea Fiber, Canola Oil, Flaxseed (source of Omega 3 & 6 Fatty Acids), Natural Flavor, Fish Oil (source of DHA- Docosahexaenoic Acid), DL-Methionine,  Choline Chloride, Potassium Chloride, L-Lysine, Pumpkin, Dried Chicory Root, Calcium Sulfate, Alfalfa Nutrient Concentrate, Taurine, Calcium Carbonate, Salt, Vitamin E Supplement, preserved with Mixed Tocopherols, L-Ascorbyl-2-Polyphosphate (source of Vitamin C), L-Carnitine, Vegetable Juice for color, Ferrous Sulfate, Niacin (Vitamin B3), Iron Amino Acid Chelate, Zinc Amino Acid Chelate, Zinc Sulfate, Blueberries, Cranberries, Barley Grass, Parsley, Turmeric, Dried Kelp, Yucca Schidigera Extract, Copper Sulfate, Thiamine Mononitrate (Vitamin B1), Copper Amino Acid Chelate, Biotin (Vitamin B7), Vitamin A Supplement, Manganese Sulfate, Manganese Amino Acid Chelate, Pyridoxine Hydrochloride (Vitamin B6), Calcium Pantothenate (Vitamin B5), Riboflavin (Vitamin B2), Vitamin D3 Supplement, Vitamin B12 Supplement, Folic Acid (Vitamin B9), Dried Yeast, Dried Enterococcus faecium fermentation product, Dried Lactobacillus acidophilus fermentation product, Dried Aspergillus niger fermentation extract, Dried Trichoderma longibrachiatum fermentation extract, Dried Bacillus subtilis fermentation extract, Calcium Iodate, Sodium Selenite, Oil of Rosemary.",28.00%,12.00%,7.00%,9.00%,
301,Authority Indoor Chicken & Rice Formula Adult Dry Cat Food,Authority,45.87,Adult,"Indoor, Pea-Free",26,4.3,"Deboned Chicken, Chicken Meal, Brewers Rice, Corn Protein Concentrate, Ground Corn, Chicken Fat (Preserved with Mixed Tocopherols), Dried Beet Pulp, Natural Flavor, Powdered Cellulose, Dried Egg Product, Potassium Chloride, Choline Chloride, Inulin, Vitamins (Vitamin E Supplement, Niacin Supplement, L-Ascorbyl-2-Polyphosphate, Vitamin A Supplement, d-Calcium Pantothenate, Thiamine Mononitrate, Pyridoxine Hydrochloride, Riboflavin Supplement, Vitamin D3 Supplement, Folic Acid, Biotin, Vitamin B12 Supplement), Sodium Hexametaphosphate, Minerals (Salt, Zinc Sulfate, Ferrous Sulfate, Copper Sulfate, Manganese Sulfate, Calcium Carbonate, Sodium Selenite, Calcium Iodate), Fish Oil, Taurine, L-Carnitine, Vegetable Oil, Lecithin, Rosemary Extract.",33.00%,12.00%,5.00%,10.00%,
302,Nulo Freestyle Salmon & Lentils Recipe Grain-Free Adult Trim Dry Cat Food,Nulo,42.09,Adult,"Grain-Free, Weight Control, Gluten Free, Low Glycemic, High-Protein",61,4.4,"Deboned Salmon, Turkey Meal, Chicken Meal, Deboned Cod, Whole Peas, Lentils, Chicken Fat (Preserved with Mixed Tocopherols & Citric Acid), Pea Fiber, Natural Flavor, Ground Flaxseed, Dried Chicory Root, Dried Kelp, Dried Cranberries, Dried Sweet Potato, Calcium Carbonate, Dl Methionine, L-Carnitine, Taurine, Zinc Proteinate, Choline Chloride, Vitamin E Supplement, L-Ascorbyl-2-Polyphosphate (Source of Vitamin C), Iron Proteinate, Niacin Supplement, Copper Proteinate, Thiamine Mononitrate, Calcium Pantothenate, Vitamin A Supplement, Manganese Proteinate, Pyridoxine Hydrochloride, Sodium Selenite, Riboflavin Supplement, Dried Bacillus Coagulans Fermentation Product, Yucca Schidigera Extract, Vitamin B12 Supplement, Calcium Iodate, Folic Acid, Rosemary Extract.",42.00%,12.00%,5.00%,10.00%,
303,"Simply Nourish Source Chicken & Turkey Recipe High-Protein Grain-Free Kitten Dry Cat Food, 5-lb bag",Simply Nourish,20.63,Kitten,"Grain-Free, High-Protein",21,4,"Deboned Chicken, Chicken meal, Turkey Meal, Dried Potatoes, Dried Peas, Chicken Fat (Preserved with Mixed Tocopherols), Ground Flaxseed, Deboned Turkey, Pea Fiber, Fish Meal, Natural Flavor, Dried Chicory Root, Fish Oil (Preserved with Mixed Tocopherols), Dried Cranberries, Vitamins (Vitamin E Supplement, Niacin Supplement, Vitamin A Supplement, Thiamine Mononitrate, d-Calcium Pantothenate, Pyridoxine Hydrochloride, Riboflavin Supplement, Folic Acid, Menadione Sodium Bisulfite Complex (Vitamin K), Vitamin D3 Supplement, Biotin, Vitamin B12 Supplement), Choline Chloride, Taurine, Minerals (Potassium Chloride, Calcium Carbonate, Zinc Sulfate, Ferrous Sulfate, Zinc Proteinate, Iron Proteinate, Manganese Sulfate, Copper Sulfate, Copper Proteinate, Manganese Proteinate, Calcium Iodate, Sodium Selenite), Mixed Tocopherols & Citric Acid (Preservatives), Rosemary Extract.",40.00%,20.00%,5.50%,10.00%,
304,Instinct Original Grain-Free Recipe with Real Rabbit Freeze-Dried Raw Coated Dry Cat Food,Instinct,33.99,Adult,"Grain-Free, Gluten Free, No Corn No Wheat No Soy, Natural, High-Protein",105,4.5,"Rabbit, Turkey Meal, Menhaden Fish Meal, Chicken Fat (preserved with Mixed Tocopherols and Citric Acid), White Fish Meal (Pacific Whiting, Pacific Sole, Pacific Rockfish), Peas, Salmon Meal, Rabbit Meal, Tapioca, Natural Flavor, Dried Tomato Pomace, Vitamins (Vitamin E Supplement, L-Ascorbyl-2-Polyphosphate, Niacin Supplement, Menadione Sodium Bisulfite Complex, Thiamine Mononitrate, d-Calcium Pantothenate, Vitamin A Supplement, Riboflavin Supplement, Pyridoxine Hydrochloride, Vitamin B12 Supplement, Folic Acid, Vitamin D3 Supplement, Biotin), Carrots, Apples, Cranberries, Montmorillonite Clay, Choline Chloride, Potassium Chloride, Minerals (Zinc Proteinate, Iron Proteinate, Copper Proteinate, Manganese Proteinate, Sodium Selenite, Ethylenediamine Dihydriodide), Freeze Dried Rabbit (including Freeze Dried Ground Rabbit Bone), Salt, DL-Methionine, Taurine, Pumpkinseeds, Dried Bacillus coagulans Fermentation Product, Freeze Dried Rabbit Liver, Freeze Dried Rabbit Lung, Freeze Dried Rabbit Kidney, Rosemary Extract.",40.50%,22.50%,3.00%,9.00%,
305,Blue Buffalo Wilderness Rocky Mountain Recipe with Red Meat Adult Grain-Free Dry Cat Food,Blue Buffalo,39.98,Adult,"No Corn No Wheat No Soy, High-Protein, Grain-Free",137,4.4,"Deboned Beef, Fish Meal, Pea Protein, Tapioca Starch, Peas, Dried Egg Product, Canola Oil (Source Of Omega 3 Fatty Acids), Beef Meal, Flaxseed (Source Of Omega 6 Fatty Acids), Pea Fiber, Natural Flavor, Calcium Chloride, Dl-Methionine, Choline Chloride, Deboned Lamb, Deboned Venison, Potatoes, Dehydrated Alfalfa Meal, Calcium Sulfate, Dried Chicory Root, Taurine, Potassium Sulfate, Alfalfa Nutrient Concentrate, Calcium Carbonate, Salt, Preserved With Mixed Tocopherols, Sweet Potatoes, Carrots, Vegetable Juice For Color, Ferrous Sulfate, Niacin (Vitamin B3), Iron Amino Acid Chelate, Zinc Amino Acid Chelate, Zinc Sulfate, Vitamin E Supplement, Blueberries, Cranberries, Barley Grass, Parsley, Turmeric, Dried Kelp, Yucca Schidigera Extract, Potassium Chloride, Copper Sulfate, Thiamine Mononitrate (Vitamin B1), Copper Amino Acid Chelate, L-Carnitine, L-Ascorbyl-2-Polyphosphate (Source Of Vitamin C), L-Lysine, Biotin (Vitamin B7), Vitamin A Supplement, Manganese Sulfate, Manganese Amino Acid Chelate, Pyridoxine Hydrochloride (Vitamin B6), Calcium Pantothenate (Vitamin B5), Riboflavin (Vitamin B2), Vitamin D3 Supplement, Vitamin B12 Supplement, Folic Acid (Vitamin B9), Dried Yeast, Dried Enterococcus Faecium Fermentation Product, Dried Lactobacillus Acidophilus Fermentation Product, Dried Aspergillus Niger Fermentation Extract, Dried Trichoderma Longibrachiatum Fermentation Extract, Dried Bacillus Subtilis Fermentation Extract, Calcium Iodate, Sodium Selenite, Oil Of Rosemary.",36.0%,16.0%,5.0%,9.0%,
306,"Taste of the Wild PREY Turkey Formula Limited Ingredient Recipe Dry Cat Food, 6-lb bag",Taste of the Wild,19.99,"Adult, Kitten","Limited Ingredient Diet, Grain-Free, No Corn No Wheat No Soy, Gluten Free, GMO-Free",14,4.6,"Turkey, Lentils, Sunflower Oil, Natural Flavor, Salmon Oil (Source Of Dha), Dl-Methionine, Dicalcium Phosphate, Calcium Carbonate, Salt, Choline Chloride, Taurine, Dried Lactobacillus Plantarum Fermentation Product, Dried Bacillus Subtilis Fermentation Product, Dried Lactobacillus Acidophilus Fermentation Product, Dried Enterococcus Faecium Fermentation Product, Dried Bifidobacterium Animalis Fermentation Product, Zinc Proteinate, Vitamin E Supplement, Niacin, Manganese Proteinate, Copper Proteinate, Zinc Sulfate, Manganese Sulfate, Copper Sulfate, Thiamine Mononitrate, Vitamin A Supplement, Biotin, Potassium Iodide, Calcium Pantothenate, Riboflavin, Pyridoxine Hydrochloride, Vitamin B12 Supplement, Manganous Oxide, Sodium Selenite, Vitamin D Supplement, Folic Acid. Contains A Source Of Live (Viable), Naturally Occurring Microorganisms.",33.00%,15.00%,3.00%,10.00%,
307,"Simply Nourish Grain-Free Chicken Recipe Adult Dry Cat Food, 7-lb bag",Simply Nourish,19.99,Adult,"Grain-Free, Gluten Free",13,4.1,"Deboned Chicken, Chicken Meal, Dried Potatoes, Dried Peas, Chicken Fat (Preserved with Mixed Tocopherols), Pea Fiber, Natural Flavor, Ground Flaxseed, Dried Chicory Root, Dried Cranberries, Choline Chloride, Dicalcium Phosphate, DL-Methionine, Vitamins (Vitamin E Supplement, Niacin Supplement, Vitamin A Supplement, Thiamine Mononitrate, d-Calcium Pantothenate, Pyridoxine Hydrochloride, Riboflavin Supplement, Folic Acid, Menadione Sodium Bisulfite Complex (Vitamin K), Vitamin D3 Supplement, Biotin, Vitamin B12 Supplement), Potassium Chloride, Taurine, Minerals (Calcium Carbonate, Zinc Sulfate, Ferrous Sulfate, Zinc Proteinate, Iron Proteinate, Manganese Sulfate, Copper Sulfate, Copper Proteinate, Manganese Proteinate, Calcium Iodate, Sodium Selenite), Mixed Tocopherols & Citric Acid (Preservatives), Rosemary Extract.",36.00%,16.00%,5.50%,10.00%,
308,CANIDAE Grain-Free Limited Ingredient Diet PURE Sea with Salmon Limited Ingredient Diet Dry Cat Food,CANIDAE,30,Adult,"Sensitive Digestion, No Corn No Wheat No Soy, Grain-Free, Gluten Free, Limited Ingredient Diet",102,3.7,"Salmon, Salmon Meal, Menhaden Fish Meal, Potatoes, Peas, Canola Oil, Sweet Potatoes, Natural Flavor, Minerals (Zinc Proteinate, Manganese Proteinate, Copper Proteinate, Zinc Sulfate, Manganese Sulfate, Copper Sulfate, Potassium Iodide, Manganous Oxide, Sodium Selenite), Vitamins (Vitamin E Supplement, Niacin, Thiamine Mononitrate, Vitamin A Supplement, Biotin, Calcium Pantothenate, Riboflavin, Pyridoxine Hydrochloride (Vitamin B6), Vitamin B12 Supplement, Vitamin D3 Supplement, Folic Acid), Choline Chloride, Dl-Methionine, Taurine, Dried Enterococcus Faecium Fermentation Product, Dried Lactobacillus Acidophilus Fermentation Product, Dried Lactobacillus Casei Fermentation Product, Dried Lactobacillus Plantarum Fermentation Product, Dried Trichoderma Longibrachiatum Fermentation Extract, Mixed Tocopherols (a Source of Vitamin E).",32.00%,17.00%,3.00%,9.00%,
309,Halo Holistic Chicken & Chicken Liver Recipe Adult Dry Cat Food,Halo,42.49,Adult,"Indoor, GMO-Free",207,4.6,"Chicken, Chicken Liver, Dried Egg Product, Dried Peas, Oatmeal, Soy Protein Concentrate, Pearled Barley, Chicken Fat (Preserved With Mixed Tocopherols), Potato Protein, Natural avor, axseed, Pea ber, Salmon Oil, Calcium Sulfate, Dicalcium Phosphate, Dried Bacillus Coagulans Fermentation Product, Dried Blueberries, Dried Cranberries, Dried Carrots, Dried Sweet Potatoes, Salt, Inulin, Vitamins (Vitamin E Supplement, Niacin Supplement, Thiamine Mononitrate, D-Calcium Pantothenate, Vitamin A Supplement, Pyridoxine Hydrochloride, Riboavin Supplement, Vitamin D3 Supplement, Vitamin B12 Supplement, Folic Acid, Biotin), Potassium Chloride, Minerals (Zinc Proteinate, Iron Proteinate, Copper Proteinate, Manganese Proteinate, Sodium Selenite, Calcium Iodate), Taurine, Mixed Tocopherols (Preservative), L-Ascorbyl-2-Polyphosphate.",32.00%,16.00%,5.00%,10.00%,
310,"Farmina Natural & Delicious Chicken & Ancestral Low-Grain Formula Dry Cat Food, 3.3-lb bag",Farmina,14.95,Adult,"Low Glycemic, Non-GMO, Natural, GMO-Free",69,4.7,"Boneless Chicken, Dehydrated Chicken, Whole Spelt, Whole Oats, Chicken Fat, Dried Whole Eggs, Herring, Dehydrated Herring, Herring Oil, Dried Beet Pulp, Pea Fiber, Dried Carrot, Suncured Alfalfa Meal, Inulin, Fructooligosaccharide, Yeast Extract, Dried Pomegranate, Dried Apple, Dried Spinach, Psyllium Seed Husk, Dried Sweet Orange, Dried Blueberry, Salt, Brewers Dried Yeast, Turmeric, Vitamin A Supplement, Vitamin D3 Supplement, Vitamin E Supplement, Ascorbic Acid, Niacin, Calcium Pantothenate, Riboflavin, Pyridoxine Hydrochloride, Thiamine Mononitrate, Biotin, Folic Acid, Vitamin B12 Supplement, Choline Chloride, Beta-Carotene, Zinc Methionine Hydroxy Analogue Chelate, Manganese Methionine Hydroxy Analogue Chelate, Ferrous Glycine, Copper Methionine Hydroxy Analogue Chelate, Dl-Methionine, Taurine, Aloe Vera Gel Concentrate, Green Tea Extract, Rosemary Extract, Mixed Tocopherols (A Preservative).",36.00%,20.00%,1.90%,8.00%,
