,product,brand,price ($),life_stage,special_diet,review_num,review_star,ingredients,protein,fat,fiber,moisture,
438,Forza10 Nutraceutic Active Urinary Dry Cat Food,Forza10,7.99,Adult,"Gluten Free, No Corn No Wheat No Soy, Limited Ingredient Diet, Non-GMO, GMO-Free, Chicken-Free, Natural",18,3.7,"Rice, Anchovy Meal, Hydrolyzed Potato Protein, Hydrolyzed Fish Protein, Vegetable Oil, Fish Oil (Preserved With Mixed Tocopherols), Dried Kelp, Minerals (Dicalcium Phosphate, Calcium Carbonate, Ferrous Sulfate, Zinc Amino Acid Chelate, Zinc Sulfate, Copper Amino Acid Complex, Copper Sulfate, Manganous Oxide, Potassium Iodide, Sodium Selenite), Brewer's Yeast, Dl-Methionine, Dried Yeast, Fructooligosaccharide (Fos), Choline Chloride, Taurine, Vitamins (Vitamin E Supplement, Niacin Supplement, Vitamin A Supplement, Vitamin B12 Supplement, Thiamine Mononitrate, Calcium Pantothenate, Riboflavin Supplement, Pyridoxine Hydrochloride, Biotin, Vitamin D3 Supplement, Folic Acid), Dried Clover Extract, Cranberries, Dried Dandelion Root Extract, Yucca Schidigera Extract, Rosemary Extract.",28%,15.50%,2.00%,8.00%,
439,Farmina N&D Prime Chicken & Pomegranate Recipe Neutered Adult Cat Dry Food,Farmina,21.95,Adult,"GMO-Free, Gluten Free, Low Glycemic, Grain-Free, Natural",,4.8,"Boneless Chicken, Dehydrated Chicken, Sweet Potatoes, Chicken Fat, Dried Whole Eggs, Fresh Herring, Dehydrated Herring, Herring Oil, Pea Fiber, Dried Carrot, Suncured Alfalfa Meal, Inulin, Fructooligosaccharide, Yeast Extract, Dried Pomegranate, Dried Apple, Dried Spinach, Psyllium Seed Husk, Dried Sweet Orange, Dried Blueberry, Salt, Brewers Dried Yeast, Turmeric, Vitamin A Supplement, Vitamin D3 Supplement, Vitamin E Supplement, Ascorbic Acid, Niacin, Calcium Pantothenate, Riboflavin, Pyridoxine Hydrochloride, Thiamine Mononitrate, Biotin, Folic Acid, Vitamin B12 Supplement, Choline Chloride, Beta-Carotene, Zinc Methionine Hydroxy Analogue Chelate, Manganese Methionine Hydroxy Analogue Chelate, Ferrous Glycine, Copper Methionine Hydroxy Analogue Chelate, Dl-Methionine, Taurine, Aloe Vera Gel Concentrate, Green Tea Extract, Rosemary Extract, Mixed Tocopherols (A Preservative).",46%,11%,5.10%,8%,
440,Royal Canin Veterinary Diet Gastrointestinal Kitten Dry Cat Food,Royal Canin Veterinary Diet,33.99,Kitten,Veterinary Diet,,4,"Chicken By-Product Meal, Corn, Chicken Fat, Wheat Gluten, Brewers Rice Flour, Natural Flavors, Fish Oil, Egg Product, Dried Plain Beet Pulp, Vegetable Oil, Potassium Chloride, Pea Fiber, Sodium Silico Aluminate, Sodium Pyrophosphate, Calcium Carbonate, Salt, Powdered Psyllium Seed Husk, L-Lysine, Fructooligosaccharides, Choline Chloride, Hydrolyzed Yeast (Source Of Betaglucans), Taurine, Vitamins [Dl-Alpha Tocopherol Acetate (Source Of Vitamin E), L-Ascorbyl-2-Polyphosphate (Source Of Vitamin C), Niacin Supplement, Biotin, Riboflavin Supplement, D-Calcium Pantothenate, Pyridoxine Hydrochloride (Vitamin B6), Vitamin A Acetate, Thiamine Mononitrate (Vitamin B1), Vitamin B12 Supplement, Folic Acid, Vitamin D3 Supplement], Marigold Extract (Tagetes Erecta L.), Trace Minerals [Zinc Proteinate, Manganese Proteinate, Zinc Oxide, Ferrous Sulfate, Manganous Oxide, Copper Sulfate, Calcium Iodate, Sodium Selenite, Copper Proteinate], Magnesium Oxide, Carotene, Rosemary Extract, Preserved With Mixed Tocopherols And Citric Acid.",33.00%,22.00%,3.70%,8.00%,
441,CANIDAE Grain-Free PURE Stream with Trout Limited Ingredient Diet Dry Cat Food,CANIDAE,29.99,Adult,"Sensitive Digestion, Grain-Free, Gluten Free, No Corn No Wheat No Soy, Limited Ingredient Diet",34,3.5,"Trout, Salmon Meal, Menhaden Fish Meal, Peas, Potatoes, Canola Oil, Sweet Potatoes, Natural Flavor, Minerals (Zinc Proteinate, Manganese Proteinate, Copper Proteinate, Zinc Sulfate, Manganese Sulfate, Copper Sulfate, Potassium Iodide, Manganous Oxide, Sodium Selenite), Vitamins (Vitamin E Supplement, Niacin, Thiamine Mononitrate, Vitamin A Supplement, Biotin, Calcium Pantothenate, Riboflavin, Pyridoxine Hydrochloride (Vitamin B6), Vitamin B12 Supplement, Vitamin D3 Supplement, Folic Acid), Choline Chloride, Dl-Methionine, Taurine, Dried Enterococcus Faecium Fermentation Product, Dried Lactobacillus Acidophilus Fermentation Product, Dried Lactobacillus Casei Fermentation Product, Dried Lactobacillus Plantarum Fermentation Product, Dried Trichoderma Longibrachiatum Fermentation Extract, Mixed Tocopherols (A Natural Source of Vitamin E).",32.00%,16.00%,3.00%,9.00%,
442,AvoDerm Natural Kitten Chicken & Herring Meal Formula Dry Cat Food,AvoDerm,8.03,Kitten,normal,23,4.4,"Chicken Meal, Chicken Fat (Preserved with Mixed Tocopherols), Ground Whole Brown Rice, Ground Whole White Rice, Peas, Dried Egg Product, Dried Tomato Pomace, Herring Meal, Avocado Meal, Natural Flavor, Salt, Whey, Dried Chicory Root, Potassium Chloride, Vitamins (Choline Chloride, A -Tocopherol Acetate (Source of Vitamin E), Niacin, Vitamin A Acetate, Thiamine Mononitrate (Source of Vitamin B1), Calcium Pantothenate, Pyridoxine Hydrochloride (Source of Vitamin B6), Menadione Sodium Bisulfite Complex, Riboflavin Supplement, Ascorbic Acid (Source of Vitamin C), Vitamin D3 Supplement, Vitamin B12 Supplement, Folic Acid, Biotin), Minerals (Zinc Sulfate, Zinc Amino Acid Chelate, Iron Amino Acid Chelate, Ferrous Sulfate, Copper Sulfate, Manganese Amino Acid Chelate, Copper Amino Acid Chelate, Manganous Oxide, Sodium Selenite, Calcium Iodate), Avocado Oil, Taurine, Calcium Carbonate, Parsley Flakes, Kelp Meal, Dl-Methionine, Yucca Schidigera Extract, Inositol.",36.00%,22.00%,3.00%,10.00%,
443,Tender & True Organic Chicken & Liver Recipe Grain-Free Dry Cat Food,Tender & True,32.99,Adult,"No Corn No Wheat No Soy, Grain-Free, Organic",37,4,"Organic Chicken, Organic Chicken Meal, Organic Tapioca Starch, Organic Pea Flour, Organic Dried Pea, Organic Chickpea, Organic Potato Flour, Organic Flaxseed Meal, Organic Chicken Fat (Preserved With Mixed Tocopherols), Organic Chicken Liver, Organic Chicken Liver Digest Meal, Menhaden Oil (Preserved With Mixed Tocopherols), Choline Chloride, Salt, Natural Mixed Tocopherols, Taurine, Ascorbic Acid, Vitamin E Supplement, Zinc Proteinate, Zinc Sulfate, Manganous Oxide, Manganese Proteinate, Inositol, Ferrous Sulfate, Niacin, Vitamin B12 Supplement, Zinc Oxide, Iron Proteinate, Thiamine Mononitrate, Biotin, Riboflavin Supplement, Calcium Pantothenate, Pyridoxine Hydrochloride, Sodium Selenite, Copper Sulfate, Vitamin A Supplement, Copper Proteinate, Citric Acid (Preservative), Vitamin D3 Supplement, Folic Acid, Potassium Iodide.",30.00%,18.00%,6.50%,10.00%,
444,Nutrisca Grain-Free Chicken Recipe Dry Cat Food,Nutrisca,31.32,Adult,"High-Protein, Low Glycemic, Grain-Free, Gluten Free, No Corn No Wheat No Soy",118,4.4,"Chicken, Chicken Meal, Peas, Turkey Meal, Chickpeas, Chicken Fat (Preserved with Mixed Tocopherols), Natural Flavor, Pea Protein, Tomato Pomace, Sunflower Oil (Preserved with Mixed Tocopherols), Potassium Chloride, Choline Chloride, Dl Methionine, Cranberries, Blueberries, Apples, Taurine, Carrots, Celery, Parsley, Lettuce, Watercress, Spinach, Beets, Zinc Sulfate, Iron Sulfate, Niacin, Vitamin E Supplement, Zinc Proteinate, Iron Proteinate, Copper Sulfate, Calcium Pantothenate, Manganese Sulfate, Copper Proteinate, Thiamine Mononitrate, Riboflavin Supplement, Pyridoxine Hydrochloride, Vitamin A Actetate, Manganese Proteinate, Iodine Iodate, Folic Acide, Cobalt Proteinate, Selenium Selenite, Biotin, Cobalt Carbonate, Vitamin B12 Supplement, Vitamin D3 Supplement, Rosemary Extract.",38.00%,16.00%,5.50%,10.00%,
445,Castor & Pollux PRISTINE Grain-Free Wild-Caught Salmon Recipe Dry Cat Food,Castor & Pollux,43.15,Adult,"No Corn No Wheat No Soy, Gluten Free, Grain-Free, Natural",11,4.5,"Salmon, Whitefish Meal, Organic Pea Protein, Turkey Meal, Organic Peas, Organic Chickpeas, Organic Tapoica, Salmon Meal, Organic Lentils, Natural Flavor, Organic Sunflower Seed Meal, Organic Coconut Oil, Chicken Fat (preserved with mixed tocopherols), Organic Flaxseed, Organic Dried Alfalfa Meal, Choline Chloride, Organic Apples, Organic Cranberries, Vitamins (Vitamin E Supplement, Niacin Supplement, Thiamine Mononitrate, d-Calcium Pantothenate, Vitamin A Supplement, Pyridoxine Hydrochloride, Riboflavin Supplement, Vitamin D3 Supplement, Biotin, Vitamin B12 Supplement, Folic Acid), Minerals (Zinc Amino Acid Complex, Iron Amino Acid Complex, Copper Amino Acid Complex, Manganese Amino Acid Complex, Sodium Selenite, Calcium Iodate), Salt, Taurine, Potassium Chloride, Rosemary Extract, Dried Bacillus coagulans Fermentation Product.",36.00%,14.00%,3.50%,11.00%,
446,"Halo Holistic Chicken & Chicken Liver Recipe Grain-Free Senior Dry Cat Food, 6-lb bag",Halo,28.22,Senior,"Grain-Free, Non-GMO, GMO-Free",62,3.2,"Chicken, Chicken Liver, Dried Egg Product, Dried Peas, Dried Lentils, Dried Potatoes, Soy Protein Concentrate, Dried Chickpeas, Natural Flavor, Pea Fiber, Flaxseed, Salmon Oil, Calcium Sulfate, Chicken Fat (Preserved With Mixed Tocopherols), Dicalcium Phosphate, Dried Bacillus Coagulans Fermentation Product, Dried Blueberries, Dried Cranberries, Dried Carrots, Dried Sweet Potatoes, Salt, Inulin, Vitamins (Vitamin E Supplement, Niacin Supplement, Thiamine Mononitrate, D-Calcium Pantothenate, Vitamin A Supplement, Pyridoxine Hydrochloride, Riboavin Supplement, Vitamin D3 Supplement, Vitamin B12 Supplement, Folic Acid, Biotin), Taurine, Potassium Chloride, Minerals (Zinc Proteinate, Iron Proteinate, Copper Proteinate, Manganese Proteinate, Sodium Selenite, Calcium Iodate), Choline Chloride, Mixed Tocopherols (Preservative), L-Ascorbyl-2-Polyphosphate, L-Carnitine.",30.00%,10.00%,5.00%,10.00%,
447,FirstMate Pacific Ocean Fish Meal with Blueberries Formula Limited Ingredient Diet Grain-Free Dry Cat Food,FirstMate,33.59,Adult,"Gluten Free, Sensitive Digestion, Grain-Free, Limited Ingredient Diet, Pea-Free, Flax-Free, High-Protein",44,4.5,"Pacific Ocean Fish Meal, Potato, Chicken Fat (Preserved with Mixed Tocopherols), Whole Blueberries, Minerals: (Zinc Proteinate, Iron Proteinate, Manganese Proteinate, Copper Proteinate, Calcium Iodate, Cobalt Carbonate, Sodium Selenite), Vitamins (Niacin, Thiamine Mononitrate, D-Calcium Pantothenate, Riboflavin, Pyridoxine Hydrochloride, Folic Acid, Biotin, Vitamin B12 Supplement, Vitamin E Supplement, Vitamin A Supplement, Vitamin D3 Supplement), Choline Chloride, Calcium Propionate (a Preservative), Dl-Methionine, Taurine, Yeast Extract (a Source of Prebiotics), Kale, Glucosamine Hydrochloride.",42.00%,18.00%,3.00%,10.00%,
448,AvoDerm Grain-Free Duck with Turkey Meal Dry Cat Food,AvoDerm,15.56,Adult,"Grain-Free, Gluten Free, No Corn No Wheat No Soy, High-Protein",17,3.6,"Duck, Turkey Meal, Peas, Pea Protein, Canola Oil (Preserved with Mixed Tocopherols), Garbanzo Beans, Tapioca Flour, Avocado, Dried Tomato Pomace, Flax Seed (Source of Omega 3), Natural Flavor, Dried Egg Product, Salt, Inulin, Potassium Chloride, Vitamins (Choline Chloride, a -Tocopherol Acetate (Source of Vitamin E), Niacin, L-Ascorbyl-2-Polyphosphate (Source of Vitamin C), Thiamine Mononitrate (Source of Vitamin B1), Menadione Sodium Bisulfite Complex (Source of Vitamin K), Vitamin A Acetate, Pyridoxine Hydrochloride (Source of Vitamin B6), Calcium Pantothenate, Riboflavin Supplement, Biotin, Vitamin B12 Supplement, Vitamin D3 Supplement, Folic Acid), Minerals (Ferrous Sulfate, Zinc Amino Acid Chelate, Zinc Sulfate, Iron Amino Acid Chelate, Copper Sulfate, Sodium Selenite, Copper Amino Acid Chelate, Manganese Sulfate, Manganese Amino Acid Chelate, Calcium Iodate), Avocado Oil, Taurine, Parsley Flakes, Kelp Meal, DL-Methionine, Yucca Schidigera Extract, Inositol.",32.00%,17.00%,6.00%,10.00%,
449,Go! SENSITIVITIES Limited Ingredient Pollock Grain-Free Dry Cat Food,Go!,18.99,Adult,"Gluten Free, Grain-Free, Limited Ingredient Diet, No Corn No Wheat No Soy, Sensitive Digestion, Natural",27,4.7,"De-Boned Alaskan Pollock, Alaskan Pollock Meal, Whole Dried Egg, Peas, Tapioca, Lentils, Chickpeas, Canola Oil (Preserved With Mixed Tocopherols), Coconut Oil (Preserved With Mixed Tocopherols), Natural Flavour, Choline Chloride, Potassium Chloride, Phosphoric Acid, Dried Chicory Root, Sodium Chloride, Vitamins (Vitamin A Supplement, Vitamin D3 Supplement, Vitamin E Supplement,Niacin, L-Ascorbyl-2-Polyphosphate(A Source Of Vitamin C), Thiamine Mononitrate, D-Calcium Pantothenate, Riboflavin, Pyridoxine Hydrochloride, Beta-Carotene, Folic Acid, Biotin, Vitamin B12 Supplement), Minerals (Zinc Proteinate, Iron Proteinate, Copper Proteinate, Zinc Oxide, Manganese Proteinate, Copper Sulphate, Calcium Iodate, Ferrous Sulphate, Manganous Oxide,Sodium Selenite), Taurine, Dl-Methionine, L-Lysine, Dried Rosemary.",30.00%,15.00%,3.00%,10%,
450,Forza10 Nutraceutic Active Intestinal Support Diet Dry Cat Food,Forza10,7.99,Adult,"Gluten Free, No Corn No Wheat No Soy, Limited Ingredient Diet, Non-GMO, GMO-Free, Chicken-Free, Natural, Sensitive Digestion",,3.6,"Ground Rice, Anchovy Meal, Hydrolyzed Fish Protein, Fish Oil (Preserved With Mixed Tocopherols), Chicken Fat, Hydrolyzed Potato Protein, Brewer's Yeast, Dried Kelp, Dried Beet Pulp, Minerals (Calcium Carbonate, Dicalcium Phosphate, Zinc Sulfate, Iron Sulfate, Copper Glycine Complex, Manganese Oxide, Sodium Selenite, Potassium Iodide), Dried Yeast, Fructooligosaccharide (Fos), Dl-Methionine, Vitamins (Vitamin A Acetate, Vitamin D3 Supplement, Vitamin E Supplement, Niacin Supplement, Vitamin B12 Supplement, Thiamine Mononitrate, Calcium Pantothenate, Riboflavin Supplement, Pyridoxine Hydrochloride, Biotin, Folic Acid), Choline Chloride, Taurine, Dried Rose Hips, Psyllium Seed Husk, Oregano, Yucca Schidigera Extract, Enterococcus Faecium Product, Rosemary Extract.",29%,10.50%,6.00%,10%,
451,Lotus Wholesome Chicken Grain-Free Recipe Dry Cat Food,Lotus,24.99,Adult,"Grain-Free, Low Glycemic, Limited Ingredient Diet, No Corn No Wheat No Soy, GMO-Free, Human-Grade",14,3.9,"Chicken, Chicken Meal, Lentils, Chicken Liver, Chickpeas, Chicken Fat (Preserved with Mixed Tocopherols and Citric Acid), Ground Flaxseed, Tapioca Flour, Pea Fiber, Brewers Dried Yeast, Dried Egg Product, Natural Yeast Flavor, Clams, Pumpkin, Apples, Sweet Potatoes, Blueberries, Spinach, Carrots, Calcium Propionate, Calcium Sulfate, Salt, Salmon Oil, New Zealand Green Mussels, Dried Kelp, Yucca schidigera, Inulin, Taurine, Vitamin E Supplement, L-Ascrobyl-2-Polyphosphate, Iron Sulfate, DL Methionine, Zinc Sulfate, Zinc Proteinate, Potassium Chloride, Niacin, Manganese Proteinate, Copper Sulfate, Copper Proteinate, Vitamin A Supplement, Manganese Sulfate, Thiamine Mononitrate, Calcium Pantothenate, Pyridixoine Hydrochloride, Biotin, Riboflavin Supplement, Vitamin B12 Supplement, Vitamin D3 Supplement, Calcium Iodate, Folic Acid, Selenium Selenite, Rosemary Extract.",35.00%,19.00%,5.00%,10.00%,
452,Nulo Freestyle Hairball Management Turkey & Cod Recipe Grain-Free Dry Cat Food,Nulo,23.15,Adult,"Grain-Free, High-Protein, Low Glycemic, No Corn No Wheat No Soy",,2.9,"Deboned Turkey, Chicken Meal, Deboned Cod, Turkey Meal, Chickpeas, Green Lentils, Miscanthus Grass, Chicken Fat (preserved with Mixed Tocopherols & Citric Acid), Salmon Meal, Natural Flavor, Flaxseed, Salmon Oil, Choline Chloride, Dried Chicory Root, Calcium Carbonate, DL-Methionine, Dried Cranberries, Dried Kelp, Dried Sweet Potatoes, Vitamin E Supplement, Yucca Schidigera Extract, L-Carnitine, Taurine, Zinc Proteinate, Niacin Supplement, Zinc Sulfate, Iron Proteinate, L-Ascorbyl-2-Polyphosphate (source of Vitamin C), Ferrous Sulfate, Vitamin A Supplement, Thiamine Mononitrate, Calcium Pantothenate, Copper Proteinate, Copper Sulfate, Manganese Proteinate, Riboflavin Supplement, Pyridoxine Hydrochloride, Biotin, Dried Bacillus coagulans Fermentation Product, Vitamin B12 Supplement, Manganous Oxide, Vitamin D3 Supplement, Folic Acid, Sodium Selenite, Calcium Iodate, Rosemary Extract.",42.00%,12.00%,5.00%,10.00%,
453,SPORTMiX Original Recipe Adult Dry Cat Food,SPORTMiX,22.99,Adult,normal,25,3.2,"Ground Corn, Chicken By-Product Meal, Corn Gluten Meal, Chicken Fat (Preserved with Mixed Tocopherols), Soybean Meal, Ground Wheat, Dicalcium Phosphate, Natural Flavors, Menhaden Fish Meal, Choline Chloride, Salt, Brewer?s Dried Yeast, Potassium Chloride, DL-Methionine, L-Lysine, Taurine, Calcium Sulfate, Vitamin A Supplement, Vitamin D3 Supplement, Vitamin E Supplement, Zinc Sulfate, Ferrous Sulfate, Niacin, Calcium Pantothenate, Riboflavin Supplement, Copper Sulfate, Pyridoxine Hydrochloride, Thiamine Mononitrate, Manganese Sulfate, Zinc Proteinate, Manganese Proteinate, Copper Proteinate, Calcium Iodate, Cobalt Carbonate, Folic Acid, Sodium Selenite, Biotin, Vitamin B12 Supplement.",30.00%,10.00%,4.00%,10.00%,
454,Dr. Gary's Best Breed Holistic All Life Stages Dry Cat Food,Dr. Gary's Best Breed,37.49,Adult,"No Corn No Wheat No Soy, Pea-Free, Indoor, Sensitive Digestion",34,4.5,"Chicken Meal, Brown Rice, Sorghum, Dried Beet Pulp, Cellulose, Egg Product, Chicken Fat [Preserved with Natural Mixed Tocopherols (Vitamin E)], Herring Meal, Brewers Dried Yeast, Natural Flavor, Fish Oil, Lecithin, Kelp Meal, Sea Salt, Potassium Chloride, Dl Methionine, L-Lysine, Calcium Carbonate, Taurine, Cranberry, Kelp Meal, Vitamin E Supplement, Niacin Supplement, Vegetable Oil, Biotin, Thiamine Mononitrate, Pyridoxine Hydrochloride, Vitamin A Acetate, Riboflavin Supplement, D-Calcium Pantothenate, Vitamin B12 Supplement, Citric Acid, Vitamin D3 Supplement, Folic Acid, Potassium Chloride, Ferrous Sulfate, Zinc Sulfate, Zinc Proteinate, Iron Proteinate, Zinc Oxide, Copper Sulfate, Manganese Sulfate, Manganese Proteinate, Copper Proteinate, Manganous Oxide, Sodium Selenite, Calcium Iodate.",30.00%,12.00%,7.00%,10.00%,
455,Go! Solutions Skin + Coat Care Grain-Free Salmon Recipe Dry Cat Food,Go!,15.99,Adult,"Indoor, No Corn No Wheat No Soy, Sensitive Digestion, Grain-Free, Natural",,4.1,"De-Boned Salmon, Salmon Meal, Peas, Tapioca, Chicken Meal, Lentils, Chicken Fat (Preserved With Mixed Tocopherols), Flaxseed, Pea Fiber, Natural Chicken Flavor, Apples, Carrots, Cranberries, Dried Chicory Root, Phosphoric Acid, Sodium Chloride, Dried Lactobacillus Acidophilus Fermentation Product, Dried Enterococcus Faecium Fermentation Product, Vitamins (Vitamin A Supplement, Vitamin D3 Supplement, Vitamin E Supplement, Niacin, L-Ascorbyl-2-Polyphosphate (A Source Of Vitamin C), Thiamine Mononitrate, D-Calcium Pantothenate, Riboflavin, Pyridoxine Hydrochloride, Beta-Carotene, Folic Acid, Biotin, Vitamin B12 Supplement), Minerals (Zinc Proteinate, Iron Proteinate, Copper Proteinate, Zinc Oxide, Manganese Proteinate, Copper Sulphate, Calcium Iodate, Ferrous Sulphate, Manganous Oxide, Sodium Selenite), Taurine, Potassium Chloride, Dl-Methionine, Choline Chloride, Dried Rosemary, Yucca Schidigera Extract.",30.00%,14.00%,4.00%,10.00%,
456,CANIDAE Grain-Free PURE Ancestral Diet Freeze-Dried Raw Coated Indoor Health Formula with Chicken Dry Cat Food,CANIDAE,34.99,Adult,"Grain-Free, Indoor, No Corn No Wheat No Soy, Raw, High-Protein",12,2.9,"Chicken, Turkey, Turkey Meal, Chicken Meal, Whitefish Meal, Peas, Potatoes, Suncured Alfalfa, Duck Meal, Chicken Fat, Flaxseed, Dried Egg, Natural Flavor, Freeze-Dried Chicken, Minerals (Zinc Proteinate, Manganese Proteinate, Copper Proteinate, Zinc Sulfate, Manganese Sulfate, Copper Sulfate, Potassium Iodide, Manganous Oxide, Sodium Selenite), Vitamins (Vitamin E Supplement, Niacin, Thiamine Mononitrate, Vitamin A Supplement, Biotin, Calcium Pantothenate, Menadione Sodium Bisulfite Complex, Riboflavin, Pyridoxine Hydrochloride (Vitamin B6), Vitamin B12 Supplement, Vitamin D3 Supplement, Folic Acid), Choline Chloride, Dl-Methionine, Taurine, Mixed Tocopherols (A Preservative), Dried Enterococcus Faecium Fermentation Product, Dried Lactobacillus Acidophilus Fermentation Product, Dried Lactobacillus Casei Fermentation Product, Dried Lactobacillus Plantarum Fermentation Product, Dried Trichoderma Longibrachiatum Fermentation Extract.",38.00%,16.00%,6.00%,9.00%,
457,"I and Love and You Naked Essentials Indoor Health Chicken & Turkey Recipe Dry Cat Food, 3.4-lb bag",I and Love and You,11.99,Adult,"Grain-Free, High-Protein, Weight Control",,3.8,"Chicken, Chicken Meal, Turkey Meal, Dried Peas, Pea Protein, Pea Starch, Menhaden Fish Meal, Ground Miscanthus Grass, Chicken Fat (Preserved With Mixed Tocopherols), Turkey, Natural Flavor, Flaxseeds, Sunflower Oil, Suncured Alfalfa Meal, Dried Sweet Potatoes, Dried Carrots, Salt, Potassium Chloride, Minerals (Iron Amino Acid Complex, Zinc Amino Acid Complex, Ferrous Sulfate, Zinc Oxide, Copper Amino Acid Complex, Copper Sulfate, Sodium Selenite, Manganese Amino Acid Complex, Manganous Oxide, Calcium Iodate), Choline Chloride, Dried Blueberries, Dried Chicory Root, Dried Cranberries, Dried Kelp, Taurine, Citric Acid (Preservative), Mixed Tocopherols (Preservative), Dried Bacillus Coagulansfermentation Product, DL-Methionine, Vitamins (Vitamin E Supplement, Niacin Supplement, Vitamin A Supplement, Thiamine Mononitrate, Menadione Sodium Bisulfite Complex, Pyridoxine Hydrochloride, D-Calcium Pantothenate, Riboflavin Supplement, Vitamin B12 Supplement, Vitamin D3 Supplement, Folic Acid, Biotin), L-Carnitine, Yucca Schidigera Extract, Rosemary Extract.",36.00%,15.00%,4.00%,10.00%,
458,"Wysong Fundamentals Dry Dog & Cat Food, 5-lb bag",Wysong,14.99,Adult,"High-Protein, Pea-Free",19,4.5,"Chicken Meal, Brown Rice, Organic Chicken, Chicken Fat (preserved with Mixed Tocopherols), Natural Flavor, Calcium Carbonate, Taurine, Calcium Propionate (a preservative), Choline Chloride, Citric Acid (a preservative), Yeast Extract, Mixed Tocopherols (a preservative), Rosemary Extract, Inulin, Yeast Culture, Minerals (Potassium Chloride, Zinc Proteinate, Zinc Sulfate, Ferrous Sulfate, Iron Proteinate, Copper Sulfate, Copper Proteinate, Manganese Sulfate, Manganese Proteinate, Sodium Selenite, Calcium Iodate), Vitamins (Ascorbic Acid [source of Vitamin C], Vitamin E Supplement, Niacin Supplement, Calcium Pantothenate, Vitamin A Supplement, Thiamine Mononitrate, Pyridoxine Hydrochloride, Riboflavin Supplement, Vitamin D3 Supplement, Biotin, Vitamin B12 Supplement, Folic Acid), Dried Aspergillus Oryzae Fermentation Product, Dried Enterococcus Faecium Fermentation Product, Dried Lactobacillus Casei Fermentation Product, Dried Lactobacillus acidophilus Fermentation Product, Dried Bacillus Subtilis Fermentation Product, Dried Lactobacillus Plantarum Fermentation Product, Dried Lactobacillus Lactis Fermentation Product.",40.00%,15.00%,4.00%,10.00%,
459,Farmina N&D Ancestral Grain Chicken & Pomegranate Recipe Neutered Cat Dry Food,Farmina,14.95,Adult,"GMO-Free, Gluten Free, Low Glycemic, Pea-Free, Natural",,4.3,"Boneless Chicken, Dehydrated Chicken, Whole Spelt, Whole Oats, Dried Whole Eggs, Herring, Dehydrated Herring, Dried Beet Pulp, Chicken Fat, Herring Oil, Pea Fiber, Suncured Alfalfa Meal, Dried Carrot, Inulin, Fructooligosaccharide, Yeast Extract, Dried Pomegranate, Dried Apple, Dried Spinach, Psyllium Seed Husk, Dried Sweet Orange, Dried Blueberry, Salt, Brewers Dried Yeast, Turmeric, Vitamin A Supplement, Vitamin D3 Supplement, Vitamin E Supplement, Ascorbic Acid, Niacin, Calcium Pantothenate, Riboflavin, Pyridoxine Hydrochloride, Thiamine Mononitrate, Biotin, Folic Acid, Vitamin B12 Supplement, Choline Chloride, Beta-Carotene, Zinc Methionine Hydroxy Analogue Chelate, Manganese Methionine Hydroxy Analogue Chelate, Ferrous Glycine, Copper Methionine Hydroxy Analogue Chelate, Dl-Methionine, Taurine, Aloe Vera Gel Concentrate, Green Tea Extract, Rosemary Extract, Mixed Tocopherols (A Preservative).",38%,10%,5.50%,8%,
460,Diamond Care Urinary Support Formula Adult Dry Cat Food,Diamond,42.99,Adult,Pea-Free,,3.3,"Chicken Meal, Brown Rice, Brewers Rice, Corn Gluten Meal, Chicken Fat (Preserved With Mixed Tocopherols), Natural Flavor, Flaxseed, Sodium Bisulfate, Potassium Chloride, Salmon Oil, Dl-Methionine, Calcium Sulfate, Taurine, Zinc Proteinate, Vitamin E Supplement, Niacin, Manganese Proteinate, Copper Proteinate, Zinc Sulfate, Manganese Sulfate, Copper Sulfate, Thiamine Mononitrate (Vitamin B1), Vitamin A Supplement, Biotin, Potassium Iodide, Calcium Pantothenate, Riboflavin (Vitamin B2), Pyridoxine Hydrochloride (Vitamin B6), Vitamin B12 Supplement, Manganous Oxide, Sodium Selenite, Vitamin D3 Supplement, Folic Acid.",30.00%,15.00%,2.00%,10.00%,
461,Fussie Cat Market Fresh Quail & Duck Meal Recipe Grain-Free Dry Cat Food,Fussie Cat,41.99,Adult,"Grain-Free, Natural",48,4.2,"Quail, Duck Meal, Peas, Pea Flour, Sunflower Oil, Duck Fat, Duck, Natural Flavors, Calcium Carbonate, Choline Chloride, Salt, Alfalfa Meal, Fructooligosaccharides, Taurine, Cranberries, Blueberries, Kelp, Vitamins (Vitamin E Supplement, Thiamine Mononitrate, Niacin Supplement, D-Calcium Pantothenate, Biotin, Vitamin A Supplement, Riboflavin Supplement, Vitamin B12 Supplement, Pyridoxine Hydrochloride, Vitamin D3 Supplement, Folic Acid), Minerals (Zinc Proteinate, Iron Proteinate, Copper Proteinate, Manganese Proteinate, Sodium Selenite, Calcium Iodate) Mixed Tocopherols.",33.00%,15.00%,5.50%,10.00%,
