,product,brand,price ($),life_stage,special_diet,review_num,review_star,ingredients,protein,fat,fiber,moisture,
137,Royal Canin Veterinary Diet Renal Support F Dry Cat Food,Royal Canin Veterinary Diet,39.99,Adult,"Sensitive Digestion, Low-Protein, Veterinary Diet",208,4.7,"Brewers Rice, Corn, Corn Gluten Meal, Chicken Fat, Pork Meal, Pea Fiber, Natural Flavors, Wheat Gluten, Chicory, Fish Oil, Calcium Carbonate, Vegetable Oil, Sodium Silico Aluminate, Dl-Methionine, Potassium Chloride, Calcium Sulfate, Psyllium Seed Husk, Potassium Citrate, Salt, Fructooligosaccharides, Choline Chloride, Taurine, Vitamins [Dl-Alpha Tocopherol Acetate (Source of Vitamin E), L-Ascorbyl-2-Polyphosphate (Source of Vitamin C), Niacin Supplement, Biotin, Riboflavin Supplement, D-Calcium Pantothenate, Pyridoxine Hydrochloride (Vitamin B6), Vitamin A Acetate, Thiamine Mononitrate (Vitamin B1), Vitamin B12 Supplement, Folic Acid, Vitamin D3 Supplement], L-Lysine, Trace Minerals [Zinc Proteinate, Zinc Oxide, Ferrous Sulfate, Manganese Proteinate, Manganous Oxide, Copper Sulfate, Calcium Iodate, Copper Proteinate, Sodium Selenite], Marigold Extract (Tagetes Erecta L.), Rosemary Extract, Preserved with Mixed Tocopherols and Citric Acid.",24.00%,15.00%,5.80%,8.00%,
138,Purina Pro Plan Focus Adult Hairball Management Chicken & Rice Formula Dry Cat Food,Purina Pro Plan,36.26,Adult,normal,157,4.8,"Chicken, Corn Gluten Meal, Brewer's Rice, Poultry By-Product Meal, Soy Protein Concentrate, Animal Fat Preserved with Mixed-Tocopherols (Form of Vitamin E), Dried Egg Product, Soybean Meal, Wheat Flour, Soy Protein Isolate, Powdered Cellulose, Fish Meal, Animal Liver Flavor, Inulin, Gelatin, Soy Lecithin, Phosphoric Acid, Salt, Calcium Carbonate, Potassium Chloride, L-Lysine Monohydrochloride, Choline Chloride, Vitamin E Supplement, Taurine, Zinc Sulfate, Ferrous Sulfate, L-Ascorbyl-2-Polyphosphate (Source of Vitamin C), Manganese Sulfate, Niacin, Vitamin A Supplement, Copper Sulfate, Calcium Pantothenate, Thiamine Mononitrate, Riboflavin Supplement, Vitamin B-12 Supplement, Pyridoxine Hydrochloride, Folic Acid, Vitamin D-3 Supplement, Calcium Iodate, Biotin, Menadione Sodium Bisulfite Complex (Source of Vitamin K Activity), Sodium Selenite. M-4621.",40.00%,16.00%,5.50%,12.00%,
139,Purina Pro Plan Focus Adult Urinary Tract Health Formula Dry Cat Food,Purina Pro Plan,19.98,Adult,normal,320,4,"Corn Gluten Meal, Chicken, Wheat Flour, Brewers Rice, Ground Yellow Corn, Animal Fat Preserved with Mixed-Tocopherols, Egg Product, Sodium Caseinate, Phosphoric Acid, Calcium Carbonate, Potassium Chloride, Animal Digest, Salt, L-Lysine Monohydrochloride, Dried Whey, Choline Chloride, Dicalcium Phosphate, Taurine, Zinc Sulfate, Ferrous Sulfate, Manganese Sulfate, Vitamin E Supplement, Niacin, Citric Acid, Vitamin A Supplement, Calcium Pantothenate, Thiamine Mononitrate, Copper Sulfate, Riboflavin Supplement, Vitamin B-12 Supplement, Pyridoxine Hydrochloride, Folic Acid, Vitamin D-3 Supplement, Calcium Iodate, Biotin, Menadione Sodium Bisulfite Complex (Source of Vitamin K Activity), Sodium Selenite. U-4625.",31.00%,14.00%,2.00%,10.00%,
140,Nutro Wholesome Essentials Chicken & Brown Rice Recipe Kitten Dry Cat Food,Nutro,13.27,Kitten,Non-GMO,111,4.7,"Chicken, Chicken Meal, Pea Protein, Chicken Fat (preserved with Mixed Tocopherols), Brewers Rice, Whole Brown Rice, Potato Protein, Whole Grain Oatmeal, Dried Plain Beet Pulp, Fish Meal, Dehydrated Alfalfa Meal, Natural Flavor, Soybean Oil (preserved with Mixed Tocopherols), Potassium Chloride, Choline Chloride, Salt, Fish Oil (preserved with Mixed Tocopherols), DL-Methionine, Mixed Tocopherols and Citric Acid (preservatives), Taurine, Zinc Sulfate, Vitamin E Supplement, L-Ascorbyl-2-Polyphosphate, Iron Amino Acid Chelate, Yucca Schidigera Extract, Vitamin B12 Supplement, Copper Amino Acid Chelate, Niacin Supplement, Manganese Amino Acid Chelate, Biotin, Riboflavin Supplement (Vitamin B2), D-Calcium Pantothenate, Thiamine Mononitrate (Vitamin B1), Vitamin A Supplement, Pyridoxine Hydrochloride (Vitamin B6), Sodium Selenite, Potassium Iodide, Vitamin D3 Supplement, Folic Acid, Rosemary Extract.",36.00%,19.00%,4.00%,10.00%,
141,"Hill's Prescription Diet c/d Multicare Stress + Metabolic, Urinary + Weight Care Chicken Flavor Dry Cat Food, 6.35-lb bag",Hill's Prescription Diet,47.99,Adult,"Weight Control, Pea-Free, Veterinary Diet",43,4.6,"Brewers Rice, Corn Gluten Meal, Powdered Cellulose, Wheat Gluten, Chicken Meal, Dried Tomato Pomace, Chicken Liver Flavor, Soybean Oil, Flaxseed, Coconut Oil, L-Lysine, Fish Oil, Lactic Acid, Potassium Citrate, Potassium Chloride, DL-Methionine, Carrots, Choline Chloride, Taurine, Iodized Salt, L-Tryptophan, vitamins (Vitamin E Supplement, Niacin Supplement, Thiamine Mononitrate, Pyridoxine Hydrochloride, Calcium Pantothenate, Riboflavin Supplement, Biotin, Vitamin B12 Supplement, Vitamin A Supplement, Folic Acid, Vitamin D3 Supplement), Dried Hydrolyzed Casein, L-Carnitine, minerals (Ferrous Sulfate, Zinc Oxide, Copper Sulfate, Manganous Oxide, Calcium Iodate, Sodium Selenite), Calcium Sulfate, Mixed Tocopherols for freshness, Natural Flavors, Beta-Carotene.",38.2%,12.9%,13.2%,,
142,Hill's Prescription Diet y/d Thyroid Care Original Dry Cat Food,Hill's Prescription Diet,60.99,Adult,"Pea-Free, Veterinary Diet",240,4.6,"Corn Gluten Meal, Pork Fat, Whole Grain Corn, Soybean Mill Run, Egg Product, Chicken Liver Flavor, L-Lysine, Potassium Citrate, Lactic Acid, Dicalcium Phosphate, Fish Oil, Choline Chloride, Calcium Carbonate, Calcium Sulfate, DL-Methionine, Taurine, L-Tryptophan, Brewers Dried Yeast, vitamins (Vitamin E Supplement, L-Ascorbyl-2-Polyphosphate (source of Vitamin C), Niacin Supplement, Thiamine Mononitrate, Calcium Pantothenate, Vitamin A Supplement, Riboflavin Supplement, Vitamin B12 Supplement, Pyridoxine Hydrochloride, Folic Acid, Biotin, Vitamin D3 Supplement), minerals (Ferrous Sulfate, Zinc Oxide, Copper Sulfate, Manganese Sulfate), L-Carnitine, Mixed Tocopherols for freshness, Natural Flavors, Beta-Carotene",30.00%,20.00%,3.50%,,
143,Solid Gold Indigo Moon with Chicken & Eggs Grain-Free High Protein Dry Cat Food,Solid Gold,33.29,Adult,"High-Protein, Grain-Free, Gluten Free, No Corn No Wheat No Soy, Indoor",295,4.7,"Chicken Meal, Potatoes, Canola Oil (Preserved with Mixed Tocopherols), Peas, Chicken, Dried Eggs, Ocean Fish Meal, Natural Flavor, Carrots, Potassium Chloride, Pumpkin, Salmon Oil (Preserved with Mixed Tocopherols), Vitamins (Vitamin E Supplement, L-Ascorbyl-2-Polyphosphate (Source of Vitamin C), Niacin, Calcium Pantothenate, Riboflavin Supplement, Pyridoxine Hydrochloride, Thiamine Mononitrate, Vitamin A Supplement, Vitamin B12 Supplement, Vitamin D3 Supplement, Biotin, Folic Acid), Taurine, Minerals (Zinc Sulfate, Ferrous Sulfate, Copper Sulfate, Manganese Sulfate, Zinc Proteinate, Manganese Proteinate, Copper Proteinate, Sodium Selenite, Calcium Iodate), Blueberries, Cranberries, DL-Methionine, Choline Chloride, Dried Chicory Root, Rosemary Extract, Dried  Lactobacillus Acidophilus Fermentation Product, Dried Enterococcus Faecium Fermentation Product, Dried Lactobacillus Casei Fermentation Product.",42.00%,20.00%,3.00%,10.00%,
144,"Wysong Uretic Dry Cat Food, 5-lb bag",Wysong,14.99,Adult,normal,261,4.2,"Chicken, Chicken Meal, Chicken Fat (preserved with Mixed Tocopherols), Potato Protein, Brown Rice, Peas, Flaxseeds, Meat Protein Isolate, Dried Plain Beet Pulp, Natural Flavor, Sesame Seeds, Dried Cheese, Dried Whey, DL-Methionine, Salt, Dried Tomato Pomace, Taurine, Calcium Carbonate, Cranberry Extract, Calcium Propionate (a preservative), Choline Chloride, Coconut Oil, Organic Barley Grass Powder, Dried Blueberry Powder, Dried Kelp, Dried Yogurt, Citric Acid (a preservative), Dried Kale, Dried Spinach, Dried Carrots, Apple Pectin, Fish Oil, Yeast Extract, Mixed Tocopherols (a preservative), Rosemary Extract, Inulin, Yeast Culture, Minerals (Potassium Chloride, Zinc Proteinate, Zinc Sulfate, Ferrous Sulfate, Iron Proteinate, Copper Sulfate, Copper Proteinate, Manganese Sulfate, Manganese Proteinate, Sodium Selenite, Calcium Iodate), Vitamins (Ascorbic Acid [source of Vitamin C], Vitamin E Supplement, Niacin Supplement, Calcium Pantothenate, Vitamin A Supplement, Thiamine Mononitrate, Pyridoxine Hydrochloride [source of Vitamin B6], Riboflavin Supplement, Vitamin D3 Supplement, Biotin, Vitamin B12 Supplement, Folic Acid), Dried Aspergillus Oryzae Fermentation Product, Dried Enterococcus Faecium Fermentation Product, Dried Lactobacillus Casei Fermentation Product, Dried Lactobacillus acidophilus Fermentation Product, Dried Bacillus Subtilis Fermentation Product, Dried Lactobacillus Plantarum Fermentation Product, Dried Lactobacillus Lactis Fermentation Product, Pepper.",42.00%,15.00%,5.00%,10.00%,
145,Royal Canin Persian Dry Cat Food,Royal Canin,29.69,Adult,normal,126,4.8,"Chicken By-Product Meal, Chicken Fat, Brewers Rice, Wheat Gluten, Corn, Corn Gluten Meal, Natural Flavors, Grain Distillers Dried Yeast, Wheat, Pea Fiber, Rice Hulls, Dried Chicory Root, Fish Oil, Calcium Sulfate, Sodium Silico Aluminate, Potassium Chloride, Vegetable Oil, Vitamins [Dl-Alpha Tocopherol Acetate (Source Of Vitamin E), Inositol, Niacin Supplement, L-Ascorbyl-2-Polyphosphate (Source Of Vitamin C), D-Calcium Pantothenate, Biotin, Pyridoxine Hydrochloride (Vitamin B6), Riboflavin Supplement, Thiamine Mononitrate (Vitamin B1), Vitamin A Acetate, Folic Acid, Vitamin B12 Supplement, Vitamin D3 Supplement], Sodium Pyrophosphate, Salt, Fructooligosaccharides, Choline Chloride, Taurine, Psyllium Seed Husk, Dl-Methionine, Hydrolyzed Yeast, Trace Minerals [Zinc Oxide, Zinc Proteinate, Ferrous Sulfate, Manganous Oxide, Manganese Proteinate, Copper Sulfate, Calcium Iodate, Sodium Selenite, Copper Proteinate], Marigold Extract (Tagetes Erecta L.), L-Carnitine, Rosemary Extract, Preserved With Mixed Tocopherols And Citric Acid.",28.00%,20.00%,6.00%,8.00%,
146,Purina Pro Plan Veterinary Diets HA Hydrolyzed Formula Dry Cat Food,Purina Pro Plan Veterinary Diets,61.99,Adult,"Pea-Free, Veterinary Diet, Hydrolyzed Protein",120,4.5,"Rice Starch, Hydrolyzed Soy Protein Isolate, Partially Hydrogenated Canola Oil Preserved with Tbhq, Hydrolyzed Chicken Liver, Tricalcium Phosphate, Powdered Cellulose, Corn Oil, Hydrolyzed Chicken, Sodium Bisulfate, Dl-Methionine, Potassium Chloride, Choline Chloride, Tetra Sodium Pyrophosphate, L-Lysine Monohydrochloride, Phosphoric Acid, Salt, Guar Gum, Taurine, Lecithin, Magnesium Oxide, Zinc Sulfate, Ferrous Sulfate, Vitamin E Supplement, Manganese Sulfate, Niacin, Calcium Carbonate, Citric Acid, Vitamin A Supplement, Calcium Pantothenate, Thiamine Mononitrate, Copper Sulfate, BHA (a Preservative), Riboflavin Supplement, Vitamin B-12 Supplement, Pyridoxine Hydrochloride, Folic Acid, Vitamin D-3 Supplement, Calcium Iodate, Biotin, Menadione Sodium Bisulfite Complex (Source of Vitamin K Activity), Sodium Selenite.",30.00%,9.00%,4.00%,10.00%,
147,Friskies Farm Favorites Chicken Dry Cat Food,Friskies,19.22,"Adult, Kitten",normal,148,4.6,"Ground Yellow Corn, Chicken By-Product Meal, Corn Gluten Meal, Soybean Meal, Ground Wheat, Beef Tallow Preserved With Mixed-Tocopherols, Chicken, Natural Liver Flavor, Calcium Carbonate, Phosphoric Acid, Salt, Choline Chloride, Dried Carrots, Dried Spinach, Potassium Chloride, Taurine, Fish Oil, Minerals [Zinc Sulfate, Ferrous Sulfate, Manganese Sulfate, Copper Sulfate, Calcium Iodate, Sodium Selenite], Vitamins [Vitamin E Supplement, Niacin (Vitamin B-3), Vitamin A Supplement, Calcium Pantothenate (Vitamin B-5), Thiamine Mononitrate (Vitamin B-1), Riboflavin Supplement (Vitamin B-2), Vitamin B-12 Supplement, Pyridoxine Hydrochloride (Vitamin B-6), Folic Acid (Vitamin B-9), Vitamin D-3 Supplement, Biotin (Vitamin B-7), Menadione Sodium Bisulfite Complex (Vitamin K)], Dl-Methionine, L-Tryptophan, Red 40, Yellow 6, Yellow 5, Blue 2. A629918",30.00%,10.50%,3.00%,12.00%,
148,Royal Canin Sensitive Digestion Dry Cat Food,Royal Canin,46.79,Adult,"Sensitive Digestion, Pea-Free",262,4.6,"Chicken Meal, Brewers Rice, Corn Gluten Meal, Chicken Fat, Wheat, Natural Flavors, Corn, Wheat Gluten, Dried Plain Beet Pulp, Fish Oil, Vegetable Oil, Calcium Sulfate, Sodium Pyrophosphate, Potassium Chloride, Sodium Silico Aluminate, Sodium Bisulfate, Choline Chloride, Fructooligosaccharides, Vitamins [DL-Alpha Tocopherol Acetate (Source Of Vitamin E), L-Ascorbyl-2-Polyphosphate (Source Of Vitamin C), Niacin Supplement, Biotin, Riboflavin Supplement, D-Calcium Pantothenate, Pyridoxine Hydrochloride (Vitamin B6), Thiamine Mononitrate (Vitamin B1), Vitamin A Acetate, Vitamin B12 Supplement, Folic Acid, Vitamin D3 Supplement], Taurine, Salt, Trace Minerals [Zinc Oxide, Ferrous Sulfate, Manganous Oxide, Copper Sulfate, Sodium Selenite, Calcium Iodate], Rosemary Extract, Preserved With Mixed Tocopherols And Citric Acid.",33.00%,20.00%,3.10%,8.00%,
149,Purina Pro Plan Adult Chicken & Egg Formula Grain-Free Dry Cat Food,Purina Pro Plan,20.98,Adult,"Sensitive Digestion, Grain-Free, No Corn No Wheat No Soy",117,4.6,"New: Chicken, Chicken Meal, Pea Protein, Dried Egg Product, Cassava Root Flour, Pea Starch, Potato Protein, Canola Meal, Beef Fat Preserved With Mixed-tocopherols, Dried Yeast, Natural Flavor, Chicory Root Inulin, Potassium Chloride, Salt, Sodium Bisulfate, Calcium Carbonate, L-lysine Monohydrochloride, Phosphoric Acid, Choline Chloride, Vitamins [Vitamin E Supplement, Niacin (Vitamin B-3), Vitamin A Supplement, Calcium Pantothenate (Vitamin B-5), Thiamine Mononitrate (Vitamin B-1), Riboflavin Supplement (Vitamin B-2), Vitamin B-12 Supplement, Pyridoxine Hydrochloride (Vitamin B-6), Folic Acid (Vitamin B-9), Vitamin D-3 Supplement, Biotin (Vitamin B-7), Menadione Sodium Bisulfite Complex (Vitamin K)], Taurine, Dl-methionine, Minerals [Zinc Sulfate, Ferrous Sulfate, Manganese Sulfate, Copper Sulfate, Calcium Iodate, Sodium Selenite], Dried Bacillus Coagulans Fermentation Product. B464219.",40.00%,16.00%,3.00%,12.00%,
150,Blue Buffalo Wilderness Duck Recipe Grain-Free Dry Cat Food,Blue Buffalo,39.98,Adult,"High-Protein, Grain-Free, No Corn No Wheat No Soy",295,4.7,"Deboned Duck, Chicken Meal, Pea Protein, Peas, Tapioca Starch, Menhaden Fish Meal (source of Omega 3 Fatty Acids), Chicken Fat (preserved with Mixed Tocopherols), Dried Egg Product, Flaxseed (source of Omega 6 Fatty Acids), Natural Flavor, Pea Fiber, Calcium Chloride, DL-Methionine, Choline Chloride, Potassium Chloride, Direct Dehydrated Alfalfa Pellets, Potatoes, Dried Chicory Root, Calcium Sulfate, Potassium Sulfate, Alfalfa Nutrient Concentrate, Calcium Carbonate, Taurine, Salt, preserved with Mixed Tocopherols, Sweet Potatoes, Carrots, Vegetable Juice for color, Ferrous Sulfate, Niacin (Vitamin B3), Iron Amino Acid Chelate, Zinc Amino Acid Chelate, Zinc Sulfate, Vitamin E Supplement, Blueberries, Cranberries, Barley Grass, Parsley, Turmeric, Dried Kelp, Yucca Schidigera Extract, Copper Sulfate, Thiamine Mononitrate (Vitamin B1), Copper Amino Acid Chelate, L-Carnitine, L-Ascorbyl-2-Polyphosphate (source of Vitamin C), L-Lysine, Biotin (Vitamin B7), Vitamin A Supplement, Manganese Sulfate, Manganese Amino Acid Chelate, Pyridoxine Hydrochloride (Vitamin B6), Calcium Pantothenate (Vitamin B5), Riboflavin (Vitamin B2), Vitamin D3 Supplement, Vitamin B12 Supplement, Folic Acid (Vitamin B9), Dried Yeast, Dried Enterococcus faecium fermentation product, Dried Lactobacillus acidophilus fermentation product, Dried Aspergillus niger fermentation extract, Dried Trichoderma longibrachiatum fermentation extract, Dried Bacillus subtilis fermentation extract, Calcium Iodate, Sodium Selenite, Oil of Rosemary.",40.0%,18.0%,4.0%,9.0%,
151,Royal Canin Appetite Control Spayed/Neutered Dry Cat Food,Royal Canin,24.29,Adult,Weight Control,96,4.7,"Chicken Meal, Corn, Corn Gluten Meal, Wheat, Powdered Cellulose, Wheat Gluten, Pea Fiber, Natural Flavors, Chicken Fat, Dried Beet Pulp, Sodium Silico Aluminate, Vegetable Oil, Grain Distillers Dried Yeast, Fish Oil, Calcium Sulfate, Potassium Chloride, Psyllium Seed Husk, Fructooligosaccharides, Salt, Choline Chloride, Monosodium Phosphate, Taurine, Dl-Methionine, Vitamins [Dl-Alpha Tocopherol (Source of Vitamin E), L-Ascorbyl-2-Polyphosphate (Source of Vitamin C), Niacin, Biotin, D-Calcium Pantothenate, Riboflavin (Vitamin B2), Pyridoxine Hydrochloride (Vitamin B6), Vitamin A Acetate, Thiamine Mononitrate (Vitamin B1), Vitamin B12 Supplement, Folic Acid, Vitamin D3 Supplement], Trace Minerals (Zinc Proteinate, Zinc Oxide, Ferrous Sulfate, Manganese Proteinate, Manganous Oxide, Copper Sulfate, Calcium Iodate, Sodium Selenite, Copper Proteinate), L-Carnitine, Rosemary Extract, Preserved with Natural Mixed Tocopherols and Citric Acid.",32.00%,10.00%,10.80%,8.00%,
152,Purina Pro Plan Veterinary Diets EN Gastroenteric Formula Dry Cat Food,Purina Pro Plan Veterinary Diets,49.99,Adult,"Sensitive Digestion, Pea-Free, Veterinary Diet",103,4.4,"Soy Protein Isolate, Poultry By-Product Meal, Corn Gluten Meal, Soy Flakes, Animal Fat Preserved with Mixed-Tocopherols (Form of Vitamin E), Corn Starch, Natural Flavor, Calcium Carbonate, Phosphoric Acid, Fish Oil, Potassium Chloride, Choline Chloride, Powdered Cellulose, Dl-Methionine, Taurine, Zinc Proteinate, Salt, Dried Colostrum, Vitamin E Supplement, Manganese Proteinate, Ferrous Sulfate, Thiamine Mononitrate, Niacin, Copper Proteinate, Vitamin A Supplement, Calcium Pantothenate, Riboflavin Supplement, Vitamin B-12 Supplement, Pyridoxine Hydrochloride, Folic Acid, Vitamin D-3 Supplement, Calcium Iodate, Biotin, Menadione Sodium Bisulfite Complex (Source of Vitamin K Activity), Sodium Selenite.",50.00%,16.00%,3.00%,12.00%,
153,Natural Balance L.I.D. Limited Ingredient Diets Green Pea & Chicken Formula Grain-Free Dry Cat Food,Natural Balance,24.29,Adult,"Sensitive Digestion, No Corn No Wheat No Soy, Limited Ingredient Diet, Grain-Free",198,4.6,"Green Peas, Chicken Meal, Chicken, Chicken Fat (Preserved with Mixed Tocopherols), Pea Protein, Natural Flavor, Salmon Oil (Preserved with Mixed Tocopherols), Calcium Carbonate, Flaxseed, Potassium Chloride, Salt, Choline Chloride, Dl-Methionine, Minerals (Zinc Proteinate,  Zinc Sulfate, Ferrous Sulfate, Iron Proteinate, Copper Sulfate, Copper Proteinate, Manganese Sulfate, Manganese Proteinate, Calcium Iodate, Sodium Selenite), Taurine, Vitamins (Vitamin E Supplement, Niacin, Thiamine Mononitrate, D-Calcium Pantothenate, Vitamin A Supplement, Pyridoxine Hydrochloride, Riboflavin Supplement, Vitamin D3 Supplement, Vitamin B12 Supplement, Folic Acid, Biotin), Mixed Tocopherols (Preservative), Rosemary Extract, Green Tea Extract, Spearmint Extract.",30.00%,12.00%,4.00%,10.00%,
154,Wellness CORE Grain-Free Indoor Formula Dry Cat Food,Wellness,40.89,Adult,"Indoor, Grain-Free, Gluten Free, No Corn No Wheat No Soy",279,4.1,"Deboned Chicken, Turkey Meal, Chicken Meal, Peas, Potatoes, Tomato Pomace, Ground Flaxseed, Chicken Fat (preserved with Mixed Tocopherols), Natural Chicken Flavor, Chicory Root Extract, Choline Chloride, Cranberries, Taurine, Vitamin E Supplement, Glucosamine Hydrochloride, Chondroitin Sulfate, Dried Kelp, L-Carnitine, Zinc Proteinate, Mixed Tocopherols added to preserve freshness, Zinc Sulfate, Calcium Carbonate, Niacin, Iron Proteinate, Ferrous Sulfate, Yucca Schidigera Extract, Vitamin A Supplement, Copper Sulfate, Thiamine Mononitrate, Copper Proteinate, Manganese Proteinate, Manganese Sulfate, d-Calcium Pantothenate, Sodium Selenite, Pyridoxine Hydrochloride, Riboflavin, Vitamin D3 Supplement,  Biotin, Calcium Iodate, Vitamin B12 Supplement, Folic Acid, Ascorbic Acid (Vitamin C), Dried Lactobacillus plantarum Fermentation Product, Dried Enterococcus faecium Fermentation Product, Dried Lactobacillus casei Fermentation Product, Dried Lactobacillus acidophilus Fermentation Product, Rosemary Extract, Green Tea Extract, Spearmint Extract.",45.00%,18.00%,3.00%,10.00%,
155,"Blue Buffalo Indoor Hairball Control Chicken & Brown Rice Recipe Mature Dry Cat Food, 7-lb bag",Blue Buffalo,21.98,Senior,"Indoor, No Corn No Wheat No Soy",107,4.6,"Deboned Chicken, Chicken Meal, Brown Rice, Barley, Oatmeal, Pea Starch, Menhaden Fish Meal (source of Omega 3 Fatty Acids), Peas, Powdered Cellulose, Chicken Fat (preserved with Mixed Tocopherols), Natural Flavor, Flaxseed (source of Omega 6 Fatty Acids), Pea Protein, Fish Oil (source of DHA-Docosahexaenoic Acid), DL- Methionine, Psyllium Seed Husks, Calcium Chloride, Choline Chloride, Potatoes, Potassium sulfate, L-Lysine, Dehydrated Alfalfa Meal, Pea Fiber, Alfalfa Nutrient Concentrate, Calcium Carbonate, Taurine, Potassium Chloride, Salt, Vitamin E Supplement, preserved with Mixed Tocopherols, Sweet Potatoes, Carrots, L-Ascorbyl-2-Polyphosphate (source of Vitamin C), L-Carnitine, Vegetable juice for color, Ferrous Sulfate, Niacin (Vitamin B3), Iron Amino Acid Chelate, Zinc Amino Acid Chelate, Zinc Sulfate, Blueberries, Cranberries, Barley Grass, Parsley, Turmeric, Dried Kelp, Yucca Schidigera Extract, Copper Sulfate, Thiamine Mononitrate (Vitamin B1), Copper Amino Acid Chelate, Biotin (Vitamin B7), Vitamin A Supplement, Manganese Sulfate, Manganese Amino Acid Chelate, Pyridoxine Hydrochloride (Vitamin B6), Calcium Pantothenate (Vitamin B5), Riboflavin (Vitamin B2), Vitamin D3 Supplement, Vitamin B12 Supplement, Folic Acid (Vitamin B9), Dried Yeast, Dried Enterococcus faecium fermentation product, Dried Lactobacillus acidophilus fermentation product, Dried Aspergillus niger fermentation extract, Dried Trichoderma longibrachiatum fermentation extract, Dried Bacillus subtilis fermentation extract, Calcium Iodate, Sodium Selenite, Oil of Rosemary.",28.00%,13.00%,6.00%,9.00%,
156,Blue Buffalo Wilderness Weight Control Chicken Recipe Grain-Free Dry Cat Food,Blue Buffalo,36.98,Adult,"High-Protein, Weight Control, Grain-Free, No Corn No Wheat No Soy",184,4.7,"Deboned Chicken, Chicken Meal, Tapioca Starch, Pea Protein, Peas, Pea Fiber,
Menhaden Fish Meal (source of Omega 3 Fatty Acids), Chicken Fat (preserved with
Mixed Tocopherols), Powdered Cellulose, Flaxseed (source of Omega 6 Fatty
Acids), Natural Flavor, Potato Starch, Calcium Chloride, DL-Methionine, Choline
Chloride, Calcium Sulfate, Dehydrated Alfalfa Meal, Potatoes, Dried Chicory
Root, Potassium Chloride, Potassium sulfate, Alfalfa Nutrient Concentrate,
Calcium Carbonate, Taurine, Salt, Sweet Potatoes, Carrots, preserved with Mixed
Tocopherols, L-Carnitine, Vegetable Juice for color, Ferrous Sulfate, Niacin
(Vitamin B3), Iron Amino Acid Chelate, Zinc Amino Acid Chelate, Zinc Sulfate,
Vitamin E Supplement, Blueberries, Cranberries, Barley Grass, Parsley, Turmeric,
Dried Kelp, Yucca Schidigera Extract, Copper Sulfate, Thiamine Mononitrate
(Vitamin B1), Copper Amino Acid Chelate, L-Ascorbyl-2-Polyphosphate (source of
Vitamin C), L-Lysine, Biotin (Vitamin B7), Vitamin A Supplement, Manganese
Sulfate, Manganese Amino Acid Chelate, Pyridoxine Hydrochloride (Vitamin B6),
Calcium Pantothenate (Vitamin B5), Riboflavin (Vitamin B2), Vitamin D3
Supplement, Vitamin B12 Supplement, Folic Acid (Vitamin B9), Dried Yeast, Dried
Enterococcus faecium fermentation product, Dried Lactobacillus acidophilus
fermentation product, Dried Aspergillus niger fermentation extract, Dried
Trichoderma longibrachiatum fermentation extract, Dried Bacillus subtilis
fermentation extract, Calcium Iodate, Sodium Selenite, Oil of Rosemary.",36.0%,12.0%,7.2%,9.0%,
157,Iams ProActive Health High Protein Chicken & Salmon Recipe Dry Cat Food,Iams,21.42,Adult,High-Protein,128,4.6,"Chicken, Chicken By-Product Meal, Corn Grits, Ground Whole Grain Corn, Salmon, Chicken Meal, Dried Beet Pulp, Natural Flavor, Sodium Bisulfate, Caramel Color, Brewers Dried Yeast, Dried Egg Product, Potassium Chloride, Salt, Choline Chloride, Fructooligosaccharides, Taurine, Carrots, Dried Apple Pomace, Vitamins (Vitamin E Supplement, Niacin, Ascorbic Acid, Vitamin A Acetate, Calcium Pantothenate, Biotin, Thiamine Mononitrate (source of vitamin B1), Pyridoxine Hydrochloride (source of vitamin B6), Vitamin B12 Supplement, Riboflavin Supplement (source of vitamin B2), Inositol, Vitamin D3 Supplement, Folic Acid), Peas, Minerals (Zinc Oxide, Manganese Sulfate, Copper Sulfate, Potassium Iodide), Spinach, Tomato, Dried Blueberry Pomace, Calcium Carbonate, Rosemary Extract.",38.00%,18.00%,3.00%,10.00%,
158,Nutro Wholesome Essentials Chicken & Brown Rice Recipe Senior Dry Cat Food,Nutro,26.01,Senior,"No Corn No Wheat No Soy, Non-GMO",150,4.6,"Chicken, Chicken Meal, Pea Protein, Whole Brown Rice, Chicken Fat (Preserved with Mixed Tocopherols), Brewer's Rice, Dehydrated Alfalfa Meal, Potato Protein, Whole Grain Oatmeal, Flaxseed, Dried Plain Beet Pulp, Natural Flavors, Potassium Chloride, Fish Oil (Preserved with Mixed Tocopherols), Soybean Oil (Preserved with Mixed Tocopherols), Choline Chloride, Salt, Dl-Methionine, Taurine, Vitamin E Supplement, Zinc Sulfate, L-Ascorbyl-2-Polyphosphate (Source of Vitamin C), Iron Amino Acid Chelate, Yucca Schidigera Extract, Vitamin B12 Supplement, Copper Amino Acid Chelate, Niacin Supplement, Sodium Selenite, Manganese Amino Acid Chelate, Biotin, Riboflavin Supplement (Vitamin B2), Calcium Pantothenate, Potassium Iodide, Thiamine Mononitrate (Vitamin B1), Vitamin A Supplement, Pyridoxine Hydrochloride (Vitamin B6), Vitamin D3 Supplement, Folic Acid, Rosemary Extract, Decaffeinated Green Tea Extract, Spearmint Extract.",36.00%,17.00%,6.00%,10.00%,
